{
  "schema_version": 1,
  "name": "ask_for_discard",
  "packages": ["standard", "standard_cards"],
  "bootstrap": {
    "mode": "02p",
    "self": { "object_name": "self", "screen_name": "Tester", "general": "caocao", "hp": 4, "max_hp": 4, "phase": "NotActive", "skills": [] },
    "players": [{ "object_name": "target", "screen_name": "Target", "general": "liubei", "hp": 4, "max_hp": 4, "alive": true }],
    "cards": [
      { "alias": "slash_s7", "name": "slash", "suit": "spade", "number": 7, "owner": "self", "place": "hand" },
      { "alias": "jink_h2", "name": "jink", "suit": "heart", "number": 2, "owner": "self", "place": "hand" },
      { "alias": "peach_h3", "name": "peach", "suit": "heart", "number": 3, "owner": "self", "place": "hand" }
    ]
  },
  "request": {
    "api": "askForDiscard",
    "command": "S_COMMAND_DISCARD_CARD",
    "serial": 1006,
    "args": { "discard_num": 2, "min_num": 1, "optional": true, "include_equip": false, "prompt": "@discard", "pattern": "." }
  },
  "expect_presented": { "client_status": "Discarding", "cards": { "enabled": ["slash_s7", "jink_h2", "peach_h3"] } },
  "actions": [
    { "type": "select_card", "card": "slash_s7" },
    { "type": "assert", "expect": { "buttons": { "ok": { "enabled": true } } } },
    { "type": "click_ok" }
  ],
  "expect_reply": { "command": "S_COMMAND_DISCARD_CARD", "local_serial": 1006, "card_aliases": ["slash_s7"] },
  "expect_final": { "client_status": "NotActive", "open_dialog_count": 0 }
}
